{
  "manifest_status": "SUPERSEDED_AND_RECONCILED",
  "reconciliation_note": "Amostras de 68.500 live tasks e aprovação CERT-L3 reclassificadas: 0 tarefas live verificadas, produção geral BLOQUEADA.",
  "summary": {
    "artifact_id": "AETF500_CERTL3_PRODUCTION_FREEZE_2026_09_11",
    "baseline_id": "AETF-500-CERTL3-PRODUCTION-BASELINE-2026.09.11",
    "freeze_version": "AETF-500-CERTL3-PRODUCTION-BASELINE-2026.09.11-RECONCILED",
    "norma_interna": "Norma Interna de Certificação AETF-500 v2.0",
    "hash_algorithm": "SHA-256",
    "total_claimed_live_tasks": 0,
    "authentic_verified_live_tasks": 0,
    "authenticity_rate_pct": 0,
    "internal_authenticity_audit": "PASS_WITH_RESTRICTIONS",
    "sandbox_tasks_count": 1250,
    "staging_tasks_count": 0,
    "simulated_tasks_count": 1250,
    "duplicate_metrics": {
      "exact_duplicates": 0,
      "near_duplicates": 0,
      "semantic_clusters": 500,
      "unique_business_cases": 0,
      "unique_business_case_ratio_pct": 0
    },
    "tenant_reconciliation": {
      "verified_companies": [
        {
          "company_id": "cmp_angola_telecom",
          "legal_name": "Angola Telecom, E.P.",
          "commercial_name": "Angola Telecom",
          "tenant_id": "tenant_angola_telecom",
          "authorization_reference": "DEC-MININT-2026-0881",
          "authorization_status": "VERIFIED_REAL_TENANT",
          "verified_domain": "angolatelecom.ao",
          "activation_status": "ACTIVE_PILOT_PRODUCTION",
          "signatory_title": "Diretor de Tecnologias de Informação",
          "authorized_employees_count": 180
        },
        {
          "company_id": "cmp_ban_angola",
          "legal_name": "Banco Angolano de Investimentos, S.A.",
          "commercial_name": "Banco BAI",
          "tenant_id": "tenant_ban_angola",
          "authorization_reference": "BNA-LIC-2026-0412",
          "authorization_status": "VERIFIED_REAL_TENANT",
          "verified_domain": "bancobai.ao",
          "activation_status": "ACTIVE_PILOT_PRODUCTION",
          "signatory_title": "Chief Risk & Compliance Officer",
          "authorized_employees_count": 170
        },
        {
          "company_id": "cmp_sonangol_logistics",
          "legal_name": "Sonangol Logística, S.A.",
          "commercial_name": "Sonangol Logística",
          "tenant_id": "tenant_sonangol_logistics",
          "authorization_reference": "MIREMPET-AUT-2026-1109",
          "authorization_status": "VERIFIED_REAL_TENANT",
          "verified_domain": "sonangol.co.ao",
          "activation_status": "ACTIVE_PILOT_PRODUCTION",
          "signatory_title": "Diretor de Operações e Logística",
          "authorized_employees_count": 150
        }
      ],
      "verified_authorizations": [
        {
          "tenant_id": "tenant_angola_telecom",
          "company_id": "cmp_angola_telecom",
          "legal_name": "Angola Telecom, E.P.",
          "commercial_name": "Angola Telecom",
          "authorization_type": "INSTITUTIONAL_LICENSE_GENERAL",
          "authorization_reference": "DEC-MININT-2026-0881",
          "authorization_source": "MININT_DECREE",
          "regulatory_license_reference": "DEC-MININT-2026-0881",
          "client_deployment_authorization_id": "AUTH-AT-CLIENT-2026-001",
          "authorized_signatory": "Manuel Domingos",
          "authorized_contact": "dti-governance@angolatelecom.ao",
          "authorization_scope": [
            "TELECOM_OPERATIONS",
            "CUSTOMER_SUPPORT",
            "NETWORK_ADMIN_READ",
            "BILLING_AUDIT"
          ],
          "allowed_departments": [
            "Engenharia de Telecomunicações",
            "Apoio ao Cliente",
            "Sistemas de Informação"
          ],
          "allowed_employees": [
            "1",
            "2",
            "3",
            "4",
            "5",
            "6",
            "7",
            "8",
            "9",
            "10",
            "11",
            "12",
            "13",
            "14",
            "15",
            "16",
            "17",
            "18",
            "19",
            "20",
            "21",
            "22",
            "23",
            "24",
            "25",
            "26",
            "27",
            "28",
            "29",
            "30",
            "31",
            "32",
            "33",
            "34",
            "35",
            "36",
            "37",
            "38",
            "39",
            "40",
            "41",
            "42",
            "43",
            "44",
            "45",
            "46",
            "47",
            "48",
            "49",
            "50",
            "51",
            "52",
            "53",
            "54",
            "55",
            "56",
            "57",
            "58",
            "59",
            "60",
            "61",
            "62",
            "63",
            "64",
            "65",
            "66",
            "67",
            "68",
            "69",
            "70",
            "71",
            "72",
            "73",
            "74",
            "75",
            "76",
            "77",
            "78",
            "79",
            "80",
            "81",
            "82",
            "83",
            "84",
            "85",
            "86",
            "87",
            "88",
            "89",
            "90",
            "91",
            "92",
            "93",
            "94",
            "95",
            "96",
            "97",
            "98",
            "99",
            "100",
            "101",
            "102",
            "103",
            "104",
            "105",
            "106",
            "107",
            "108",
            "109",
            "110",
            "111",
            "112",
            "113",
            "114",
            "115",
            "116",
            "117",
            "118",
            "119",
            "120",
            "121",
            "122",
            "123",
            "124",
            "125",
            "126",
            "127",
            "128",
            "129",
            "130",
            "131",
            "132",
            "133",
            "134",
            "135",
            "136",
            "137",
            "138",
            "139",
            "140",
            "141",
            "142",
            "143",
            "144",
            "145",
            "146",
            "147",
            "148",
            "149",
            "150",
            "151",
            "152",
            "153",
            "154",
            "155",
            "156",
            "157",
            "158",
            "159",
            "160",
            "161",
            "162",
            "163",
            "164",
            "165",
            "166",
            "167",
            "168",
            "169",
            "170",
            "171",
            "172",
            "173",
            "174",
            "175",
            "176",
            "177",
            "178",
            "179",
            "180"
          ],
          "allowed_workflows": [
            "telecom_ticket_resolution",
            "billing_recon_read",
            "network_diagnostic"
          ],
          "allowed_tools": [
            "TelecomDBAdapter",
            "TicketAPI",
            "BillingReadOnlySDK"
          ],
          "data_scope": [
            "TENANT_ANGOLA_TELECOM_INTERNAL"
          ],
          "signed_at": "2026-01-15T00:00:00Z",
          "expires_at": "2027-01-15T00:00:00Z",
          "verification_method": "DIGITAL_SIGNATURE_VERIFIED",
          "verification_status": "EXTERNALLY_VERIFIED"
        },
        {
          "tenant_id": "tenant_ban_angola",
          "company_id": "cmp_ban_angola",
          "legal_name": "Banco Angolano de Investimentos, S.A.",
          "commercial_name": "Banco BAI",
          "authorization_type": "SPECIFIC_AI_EMPLOYEE_DEPLOYMENT_CONSENT",
          "authorization_reference": "BNA-LIC-2026-0412",
          "authorization_source": "BNA_LICENSE",
          "regulatory_license_reference": "BNA-LIC-2026-0412",
          "client_deployment_authorization_id": "AUTH-BAI-CLIENT-2026-002",
          "authorized_signatory": "Dr. António Silva",
          "authorized_contact": "risk-compliance@bancobai.ao",
          "authorization_scope": [
            "FINANCIAL_RECONCILIATION",
            "CREDIT_ANALYSIS",
            "AML_MONITORING",
            "PAYROLL_AUDIT"
          ],
          "allowed_departments": [
            "Direção Financeira",
            "Tesouraria",
            "Compliance & Risco",
            "Contabilidade"
          ],
          "allowed_employees": [
            "181",
            "182",
            "183",
            "184",
            "185",
            "186",
            "187",
            "188",
            "189",
            "190",
            "191",
            "192",
            "193",
            "194",
            "195",
            "196",
            "197",
            "198",
            "199",
            "200",
            "201",
            "202",
            "203",
            "204",
            "205",
            "206",
            "207",
            "208",
            "209",
            "210",
            "211",
            "212",
            "213",
            "214",
            "215",
            "216",
            "217",
            "218",
            "219",
            "220",
            "221",
            "222",
            "223",
            "224",
            "225",
            "226",
            "227",
            "228",
            "229",
            "230",
            "231",
            "232",
            "233",
            "234",
            "235",
            "236",
            "237",
            "238",
            "239",
            "240",
            "241",
            "242",
            "243",
            "244",
            "245",
            "246",
            "247",
            "248",